<?xml version="1.0" encoding="UTF-8"?>
<school xmlns:xsi="http://www.w3.org/2001/XMLSchema-instance"
        xsi:noNamespaceSchemaLocation="student_unique.xsd">

    <student>
        <id>SV201</id>
        <name>Nguyễn Văn Hùng</name>
        <date>2000-06-15</date>
    </student>

    <student>
        <id>SV202</id>
        <name>Trần Thị Hoa</name>
        <date>1999-12-09</date>
    </student>

    <student>
        <id>SV203</id>
        <name>Phạm Minh Quân</name>
        <date>2001-03-27</date>
    </student>

</school>
